{
  "$schema": "https://json-schema.org/draft/2020-12/schema",
  "$id": "https://github.com/philoserf/ctchargen/docs/character.schema.json",
  "title": "Classic Traveller character record",

  "description": "What ctchargen writes, as this build writes it. A description of the output, kept honest by the gate - not a promise to records already written. Across builds nothing is promised: changing the procedure, the dice-stream consumption order, or an event's wording changes the output for a given seed, and that is an ordinary change. What makes that affordable is that a record is regenerable from its seed and its inputs, and nothing in it is hand-written.\n\nTwo of the optional benefit fields cannot appear together in any character this tool can generate. Book 1 p. 9 prints Travellers' Aid only in the Navy and Marines columns of Mustering Out Table 1, and the two starships only in the Scout and Merchant columns, and a character serves one service. So no valid record carries both travellersAid and ships. That is a fact about the rules rather than a gap in the fixtures, which is why character.complete.json shows the ships and not the membership.\n\nThe root object accepts a field it does not know; every object inside it does not. That is the narrower half of the v1.0.0 freeze, and it is deliberate (#76, #113). A later build may add a top-level section, and a reader holding this schema will load the record and render what it understands. A key added inside an existing object is still refused, and so is an event of a kind this build does not write, because those are the structures a sheet is rendered from and pinning them is what keeps this schema worth validating against.",

  "type": "object",
  "additionalProperties": true,
  "required": [
    "record", "name", "upp", "characteristics", "age", "terms",
    "enlistment", "skills", "benefits", "inputs", "errata", "ruleset", "events"
  ],

  "properties": {
    "record": {
      "type": "integer",
      "minimum": 1,
      "description": "The shape of this record, not the build that wrote it and not the ruleset it reads. It is 1 until v1.0.0 and counts from there, not from every change: the record moves freely before the freeze, so a build that changes the shape before it leaves this alone and two pre-release shapes may both say 1. From v1.0.0 the shape is a public contract and a build that changes it says so here. A minimum rather than a fixed number, so that a record from a later build validates against a reader's copy of this schema instead of being refused before its contents are looked at; what this build writes is held to 1 by a test of its own."
    },
    "name": {
      "type": "string",
      "description": "Blank unless --name supplied one. Book 1 pp. 4-5 give naming as advice, not a table, so nothing generates one."
    },
    "upp": {
      "type": "string",
      "pattern": "^[0-9A-F]{6}$",
      "description": "The Universal Personality Profile (p. 8): the six characteristics as hexadecimal digits in rolled order. Derived from characteristics, and stored beside them so a reader need not re-derive it."
    },
    "characteristics": {
      "type": "object",
      "additionalProperties": false,
      "required": ["Strength", "Dexterity", "Endurance", "Intelligence", "Education", "Social Standing"],
      "description": "The six of p. 4, numeric. A value may reach 0 only through aging (E010); everything else floors at 1, and nothing exceeds 15.",
      "properties": {
        "Strength": { "$ref": "#/$defs/characteristic" },
        "Dexterity": { "$ref": "#/$defs/characteristic" },
        "Endurance": { "$ref": "#/$defs/characteristic" },
        "Intelligence": { "$ref": "#/$defs/characteristic" },
        "Education": { "$ref": "#/$defs/characteristic" },
        "Social Standing": { "$ref": "#/$defs/characteristic" }
      }
    },
    "age": {
      "type": "object",
      "additionalProperties": false,
      "required": ["years"],
      "description": "Whole years, plus the months only a medical crisis recovery adds (pp. 7-8). Books 1-3 have no calendar and no birthdate rules, so the record carries an age and a count of terms, not a date.",
      "properties": {
        "years": { "type": "integer", "minimum": 18 },
        "months": { "type": "integer", "minimum": 1, "maximum": 11 }
      }
    },
    "terms": {
      "type": "integer",
      "minimum": 0,
      "description": "Terms of service, four years each (p. 5). Zero for a civilian. No upper bound: a 12 on the reenlistment throw recurs (E003)."
    },
    "enlistment": {
      "type": "object",
      "additionalProperties": false,
      "required": ["how"],
      "properties": {
        "how": {
          "enum": ["enlisted", "drafted", "declined the draft"],
          "description": "P. 5. Declining is a complete record: an eighteen-year-old civilian (E001)."
        },
        "service": { "$ref": "#/$defs/service" }
      }
    },
    "service": { "$ref": "#/$defs/service" },
    "rank": {
      "type": "integer",
      "minimum": 1,
      "maximum": 6,
      "description": "An index into the service's own Table of Ranks (p. 10). Absent where the character holds none: rank 0 is not commissioned, and the Scouts and Other print no ranks at all."
    },
    "rankName": {
      "type": "string",
      "description": "What the Table of Ranks calls that rank in that service (p. 10). A name and not a title: the book keeps that word for nobility."
    },
    "skills": {
      "type": "array",
      "description": "Name and level, sorted by name. Where the rules demand a specific weapon, the name is that weapon's: p. 25's own list records Dagger-1, not Blade Combat.",
      "items": {
        "type": "object",
        "additionalProperties": false,
        "required": ["name", "level"],
        "properties": {
          "name": { "type": "string", "minLength": 1 },
          "level": { "type": "integer", "minimum": 1 }
        }
      }
    },
    "benefits": {
      "type": "object",
      "additionalProperties": false,
      "required": ["cash"],
      "properties": {
        "cash": { "$ref": "#/$defs/credits" },
        "passages": {
          "type": "array",
          "items": { "enum": ["High Passage", "Middle Passage", "Low Passage"] }
        },
        "travellersAid": {
          "const": true,
          "description": "Membership, achievable only once per character; a duplicate roll is wasted (p. 22)."
        },
        "weapons": {
          "type": "array",
          "items": { "type": "string", "minLength": 1 },
          "description": "Weapons received as benefits, which is narrower than the weapons held: expertise may be taken only in one received as a benefit (p. 22)."
        },
        "ships": {
          "type": "array",
          "maxItems": 2,
          "items": {
            "type": "object",
            "additionalProperties": false,
            "required": ["kind", "tons", "years", "paymentYears"],
            "properties": {
              "kind": { "enum": ["Scout ship, Type S", "Free Trader, Type A"] },
              "tons": {
                "type": "integer",
                "enum": [100, 200],
                "description": "The hull each is built on: Book 2 p. 18 for the Type S, p. 19 for the Type A."
              },
              "years": { "type": "integer", "minimum": 0 },
              "paymentYears": {
                "type": "integer",
                "minimum": 0,
                "maximum": 40,
                "description": "Years of payments left on a Free Trader (pp. 22-23). A scout ship is held without title and carries none."
              }
            }
          }
        },
        "scoutShipsLost": {
          "type": "integer",
          "minimum": 1,
          "description": "Scout ships a duplicate roll lost. P. 23: \"Only one scout ship may be acquired by a character, and throws resulting in additional ships are lost.\""
        }
      },
      "not": {
        "required": ["travellersAid", "ships"],
        "description": "P. 9 prints Travellers' Aid only in the Navy and Marines columns of Mustering Out Table 1 and the two starships only in the Scout and Merchant columns, and a character serves one service. No record this tool can generate carries both."
      }
    },
    "annualRetirementPay": {
      "$ref": "#/$defs/credits",
      "description": "P. 21. Earned by leaving at the end of the fifth term or later, whatever caused it, and not available to the Scouts or Other."
    },
    "departure": {
      "type": "object",
      "additionalProperties": false,
      "required": ["how"],
      "description": "How the service ended. Absent for a civilian, who never joined one.",
      "properties": {
        "how": {
          "enum": [
            "discharged", "forced out", "retired",
            "killed by the survival throw", "killed by a medical crisis"
          ]
        },
        "fatal": { "const": true },
        "characteristic": {
          "$ref": "#/$defs/characteristicName",
          "description": "The characteristic that reached zero, on a death by medical crisis (pp. 7-8, E008)."
        }
      }
    },
    "nobility": {
      "type": "object",
      "additionalProperties": false,
      "required": ["eligible", "title", "assumed"],
      "description": "Assessed once, at the end of generation, against the final Social Standing, for every character including the dead - who are assessed but not asked (E011).",
      "properties": {
        "eligible": { "const": true },
        "title": {
          "enum": ["knight/dame", "baron/baroness", "marquis/marchioness", "count/countess", "duke/duchess"],
          "description": "Book 3 p. 22, for Social Standing 11 through 15."
        },
        "assumed": { "type": "boolean" }
      }
    },
    "inputs": {
      "type": "object",
      "additionalProperties": false,
      "required": ["seed", "career", "skills", "muster"],
      "description": "Everything the generation was given, so that a record says what made it.",
      "properties": {
        "seed": {
          "type": "integer",
          "minimum": 0,
          "description": "The one recorded seed, filling both words of the PCG state. A seed the tool draws for itself is bounded to 2^53-1, above which a reader parsing JSON numbers as doubles would round it silently; an explicit --seed is the operator's own number and is written as given."
        },
        "name": { "type": "string" },
        "service": {
          "$ref": "#/$defs/service",
          "description": "Present when --service forced the enlistment attempt. It forces the attempt only: the throw is still made, and a failed throw still goes to the draft."
        },
        "career": { "enum": ["serve", "retire", "oneterm"] },
        "skills": { "enum": ["advanced", "service", "personal"] },
        "muster": { "enum": ["cash", "goods", "spartan"] }
      }
    },
    "errata": {
      "type": "array",
      "description": "Every recorded reading of docs/ERRATA.md that governed this record, in id order. A reading applied without appearing here is the one defect no gate catches.",
      "items": { "type": "string", "pattern": "^E[0-9]{3}$" }
    },
    "ruleset": {
      "const": "Classic Traveller, Books 1-3 (FFE reprint of the 1977 text)",
      "description": "The text this record was generated under. Every page cite in its log is to these three books and nothing else."
    },
    "policy": {
      "type": "integer",
      "minimum": 1,
      "description": "The version of docs/POLICY.md that answered this record's choice points. Absent from a record the policy answered nothing in - one walked by hand - because naming a table that decided none of it is a claim the record cannot support. It moves only when an answer in that table changes, which is what a referee reads to tell why two records from one seed differ; ruleset names the rules and build names the writer, and neither moves for that reason."
    },
    "build": {
      "type": "string",
      "description": "The build that wrote the record, from debug.ReadBuildInfo - the same source the version subcommand reports. With cross-build reproduction unpromised, naming the build is the whole of what makes a record reasonable about.\n\nThe command fills it, and only the command: a record generated in-process by a test carries none, because a test binary's build info is not the build of a released tool and would make a golden differ by machine. So the goldens and the two examples beside this schema have no build, and a record written by ctchargen does."
    },
    "events": {
      "type": "array",
      "description": "The generation record: every step entered, throw made, choice answered and consequence, with monotonic sequence numbers. Walk it against Book 1 to audit any character.",
      "items": {
        "oneOf": [
          { "$ref": "#/$defs/stepEvent" },
          { "$ref": "#/$defs/throwEvent" },
          { "$ref": "#/$defs/rollEvent" },
          { "$ref": "#/$defs/choiceEvent" },
          { "$ref": "#/$defs/outcomeEvent" }
        ]
      }
    }
  },

  "$defs": {
    "characteristic": { "type": "integer", "minimum": 0, "maximum": 15 },
    "characteristicName": {
      "enum": ["Strength", "Dexterity", "Endurance", "Intelligence", "Education", "Social Standing"]
    },
    "service": {
      "enum": ["Navy", "Marines", "Army", "Scouts", "Merchants", "Other"],
      "description": "The six of the Prior Service Table (p. 10), spelled as p. 5 lists them (E012)."
    },
    "credits": { "type": "integer", "minimum": 0 },
    "sequence": { "type": "integer", "minimum": 1 },

    "stepEvent": {
      "type": "object",
      "additionalProperties": false,
      "required": ["seq", "kind", "step"],
      "properties": {
        "seq": { "$ref": "#/$defs/sequence" },
        "kind": { "const": "step" },
        "step": { "type": "string", "minLength": 1 },
        "pages": { "type": "string" }
      }
    },
    "throwEvent": {
      "type": "object",
      "additionalProperties": false,
      "required": ["seq", "kind", "step", "dice", "target", "total", "succeeded"],
      "properties": {
        "seq": { "$ref": "#/$defs/sequence" },
        "kind": { "const": "throw" },
        "step": { "type": "string", "minLength": 1 },
        "dice": {
          "type": "array",
          "minItems": 1,
          "maxItems": 2,
          "items": { "type": "integer", "minimum": 1, "maximum": 6 },
          "description": "The dice as rolled, first die then second. The record logs the dice and not only their total, because that is what an auditor walks against the page."
        },
        "dm": { "type": "integer" },
        "target": {
          "type": "string",
          "pattern": "^[0-9]+[+-]?$",
          "description": "The throw's target in the book's own notation (pp. 2-3). Required: a throw is the case that has something to meet, and a roll with nothing to meet is a rollEvent."
        },
        "total": { "type": "integer" },
        "succeeded": { "type": "boolean" }
      }
    },
    "rollEvent": {
      "type": "object",
      "description": "One roll with nothing to meet: the draft die, a skills table, a mustering out table, the months of recovery. It keeps the modifier, because the row the page is read at is the face plus the DM, and it carries no target and no outcome because there is nothing to succeed at.",
      "additionalProperties": false,
      "required": ["seq", "kind", "step", "dice", "total"],
      "properties": {
        "seq": { "$ref": "#/$defs/sequence" },
        "kind": { "const": "roll" },
        "step": { "type": "string", "minLength": 1 },
        "dice": {
          "type": "array",
          "minItems": 1,
          "maxItems": 2,
          "items": { "type": "integer", "minimum": 1, "maximum": 6 },
          "description": "The dice as rolled. The record logs the dice and not only their total, because that is what an auditor walks against the page."
        },
        "dm": { "type": "integer" },
        "total": { "type": "integer" }
      }
    },
    "choiceEvent": {
      "type": "object",
      "additionalProperties": false,
      "required": ["seq", "kind", "point", "by", "alternatives", "chosen"],
      "properties": {
        "seq": { "$ref": "#/$defs/sequence" },
        "kind": { "const": "choice" },
        "point": {
          "enum": [
            "Service", "SubmitToDraft", "AttemptCommission", "AttemptPromotion",
            "SkillTable", "Weapon", "ReenlistIntent", "MusterTable",
            "MusterTable1DM", "MusterTable2DM", "MusterWeapon", "AssumeTitle"
          ],
          "description": "One per method of the Decider interface, which is what closes the set. docs/POLICY.md carries one row per method."
        },
        "by": { "enum": ["player", "policy"] },
        "alternatives": { "type": "array", "items": { "type": "string" } },
        "chosen": { "type": "string" }
      }
    },
    "outcomeEvent": {
      "type": "object",
      "additionalProperties": false,
      "required": ["seq", "kind", "description"],
      "properties": {
        "seq": { "$ref": "#/$defs/sequence" },
        "kind": { "const": "outcome" },
        "because": {
          "$ref": "#/$defs/sequence",
          "description": "The throw or choice that caused this. Absent where the consequence follows from the procedure itself."
        },
        "description": { "type": "string", "minLength": 1 },
        "errata": { "type": "array", "items": { "type": "string", "pattern": "^E[0-9]{3}$" } }
      }
    }
  }
}
