{
  "record": 1,
  "name": "",
  "upp": "9346C5",
  "characteristics": {
    "Dexterity": 3,
    "Education": 12,
    "Endurance": 4,
    "Intelligence": 6,
    "Social Standing": 5,
    "Strength": 9
  },
  "age": {
    "years": 34
  },
  "terms": 4,
  "enlistment": {
    "how": "enlisted",
    "service": "Other"
  },
  "service": "Other",
  "skills": [
    {
      "name": "Computer",
      "level": 2
    },
    {
      "name": "Electronic",
      "level": 1
    },
    {
      "name": "Jack of all Trades",
      "level": 1
    }
  ],
  "benefits": {
    "cash": 0
  },
  "departure": {
    "how": "killed by the survival throw",
    "fatal": true
  },
  "inputs": {
    "seed": 5,
    "service": "Other",
    "career": "serve",
    "skills": "advanced",
    "muster": "cash"
  },
  "errata": [
    "E002",
    "E004"
  ],
  "ruleset": "Classic Traveller, Books 1-3 (FFE reprint of the 1977 text)",
  "events": [
    {
      "seq": 1,
      "kind": "step",
      "step": "characteristics",
      "pages": "p. 4"
    },
    {
      "seq": 2,
      "kind": "roll",
      "step": "Strength",
      "dice": [
        5,
        4
      ],
      "total": 9
    },
    {
      "seq": 3,
      "kind": "outcome",
      "because": 2,
      "description": "Strength 9"
    },
    {
      "seq": 4,
      "kind": "roll",
      "step": "Dexterity",
      "dice": [
        2,
        1
      ],
      "total": 3
    },
    {
      "seq": 5,
      "kind": "outcome",
      "because": 4,
      "description": "Dexterity 3"
    },
    {
      "seq": 6,
      "kind": "roll",
      "step": "Endurance",
      "dice": [
        1,
        3
      ],
      "total": 4
    },
    {
      "seq": 7,
      "kind": "outcome",
      "because": 6,
      "description": "Endurance 4"
    },
    {
      "seq": 8,
      "kind": "roll",
      "step": "Intelligence",
      "dice": [
        2,
        4
      ],
      "total": 6
    },
    {
      "seq": 9,
      "kind": "outcome",
      "because": 8,
      "description": "Intelligence 6"
    },
    {
      "seq": 10,
      "kind": "roll",
      "step": "Education",
      "dice": [
        6,
        6
      ],
      "total": 12
    },
    {
      "seq": 11,
      "kind": "outcome",
      "because": 10,
      "description": "Education 12"
    },
    {
      "seq": 12,
      "kind": "roll",
      "step": "Social Standing",
      "dice": [
        2,
        3
      ],
      "total": 5
    },
    {
      "seq": 13,
      "kind": "outcome",
      "because": 12,
      "description": "Social Standing 5"
    },
    {
      "seq": 14,
      "kind": "outcome",
      "description": "UPP 9346C5 at age 18"
    },
    {
      "seq": 15,
      "kind": "step",
      "step": "enlistment",
      "pages": "pp. 5, 10"
    },
    {
      "seq": 16,
      "kind": "throw",
      "step": "enlistment, Other",
      "dice": [
        5,
        6
      ],
      "target": "3+",
      "total": 11,
      "succeeded": true
    },
    {
      "seq": 17,
      "kind": "outcome",
      "because": 16,
      "description": "enlisted in the Other"
    },
    {
      "seq": 18,
      "kind": "step",
      "step": "term 1",
      "pages": "pp. 5-7"
    },
    {
      "seq": 19,
      "kind": "throw",
      "step": "survival",
      "dice": [
        3,
        6
      ],
      "target": "5+",
      "total": 9,
      "succeeded": true
    },
    {
      "seq": 20,
      "kind": "outcome",
      "because": 19,
      "description": "survived term 1"
    },
    {
      "seq": 21,
      "kind": "step",
      "step": "skills and training",
      "pages": "pp. 6, 11"
    },
    {
      "seq": 22,
      "kind": "choice",
      "point": "SkillTable",
      "by": "policy",
      "alternatives": [
        "Personal Development Table",
        "Service Skills Table",
        "Advanced Education Table",
        "Advanced Education Table (education 8+)"
      ],
      "chosen": "Advanced Education Table (education 8+)"
    },
    {
      "seq": 23,
      "kind": "roll",
      "step": "Advanced Education Table (education 8+)",
      "dice": [
        4
      ],
      "total": 4
    },
    {
      "seq": 24,
      "kind": "outcome",
      "because": 23,
      "description": "Computer-1",
      "errata": [
        "E002"
      ]
    },
    {
      "seq": 25,
      "kind": "choice",
      "point": "SkillTable",
      "by": "policy",
      "alternatives": [
        "Personal Development Table",
        "Service Skills Table",
        "Advanced Education Table",
        "Advanced Education Table (education 8+)"
      ],
      "chosen": "Advanced Education Table (education 8+)"
    },
    {
      "seq": 26,
      "kind": "roll",
      "step": "Advanced Education Table (education 8+)",
      "dice": [
        6
      ],
      "total": 6
    },
    {
      "seq": 27,
      "kind": "outcome",
      "because": 26,
      "description": "Jack of all Trades-1",
      "errata": [
        "E002"
      ]
    },
    {
      "seq": 28,
      "kind": "throw",
      "step": "reenlistment",
      "dice": [
        5,
        2
      ],
      "target": "5+",
      "total": 7,
      "succeeded": true
    },
    {
      "seq": 29,
      "kind": "choice",
      "point": "ReenlistIntent",
      "by": "policy",
      "alternatives": [
        "continue",
        "discharge"
      ],
      "chosen": "continue"
    },
    {
      "seq": 30,
      "kind": "outcome",
      "because": 28,
      "description": "reenlisted for term 2"
    },
    {
      "seq": 31,
      "kind": "step",
      "step": "term 2",
      "pages": "pp. 5-7"
    },
    {
      "seq": 32,
      "kind": "throw",
      "step": "survival",
      "dice": [
        5,
        1
      ],
      "target": "5+",
      "total": 6,
      "succeeded": true
    },
    {
      "seq": 33,
      "kind": "outcome",
      "because": 32,
      "description": "survived term 2"
    },
    {
      "seq": 34,
      "kind": "step",
      "step": "skills and training",
      "pages": "pp. 6, 11"
    },
    {
      "seq": 35,
      "kind": "choice",
      "point": "SkillTable",
      "by": "policy",
      "alternatives": [
        "Personal Development Table",
        "Service Skills Table",
        "Advanced Education Table",
        "Advanced Education Table (education 8+)"
      ],
      "chosen": "Advanced Education Table (education 8+)"
    },
    {
      "seq": 36,
      "kind": "roll",
      "step": "Advanced Education Table (education 8+)",
      "dice": [
        3
      ],
      "total": 3
    },
    {
      "seq": 37,
      "kind": "outcome",
      "because": 36,
      "description": "Electronic-1",
      "errata": [
        "E002"
      ]
    },
    {
      "seq": 38,
      "kind": "throw",
      "step": "reenlistment",
      "dice": [
        4,
        5
      ],
      "target": "5+",
      "total": 9,
      "succeeded": true
    },
    {
      "seq": 39,
      "kind": "choice",
      "point": "ReenlistIntent",
      "by": "policy",
      "alternatives": [
        "continue",
        "discharge"
      ],
      "chosen": "continue"
    },
    {
      "seq": 40,
      "kind": "outcome",
      "because": 38,
      "description": "reenlisted for term 3"
    },
    {
      "seq": 41,
      "kind": "step",
      "step": "term 3",
      "pages": "pp. 5-7"
    },
    {
      "seq": 42,
      "kind": "throw",
      "step": "survival",
      "dice": [
        1,
        6
      ],
      "target": "5+",
      "total": 7,
      "succeeded": true
    },
    {
      "seq": 43,
      "kind": "outcome",
      "because": 42,
      "description": "survived term 3"
    },
    {
      "seq": 44,
      "kind": "step",
      "step": "skills and training",
      "pages": "pp. 6, 11"
    },
    {
      "seq": 45,
      "kind": "choice",
      "point": "SkillTable",
      "by": "policy",
      "alternatives": [
        "Personal Development Table",
        "Service Skills Table",
        "Advanced Education Table",
        "Advanced Education Table (education 8+)"
      ],
      "chosen": "Advanced Education Table (education 8+)"
    },
    {
      "seq": 46,
      "kind": "roll",
      "step": "Advanced Education Table (education 8+)",
      "dice": [
        4
      ],
      "total": 4
    },
    {
      "seq": 47,
      "kind": "outcome",
      "because": 46,
      "description": "Computer-2",
      "errata": [
        "E002"
      ]
    },
    {
      "seq": 48,
      "kind": "throw",
      "step": "reenlistment",
      "dice": [
        2,
        5
      ],
      "target": "5+",
      "total": 7,
      "succeeded": true
    },
    {
      "seq": 49,
      "kind": "choice",
      "point": "ReenlistIntent",
      "by": "policy",
      "alternatives": [
        "continue",
        "discharge"
      ],
      "chosen": "continue"
    },
    {
      "seq": 50,
      "kind": "outcome",
      "because": 48,
      "description": "reenlisted for term 4"
    },
    {
      "seq": 51,
      "kind": "step",
      "step": "term 4",
      "pages": "pp. 5-7"
    },
    {
      "seq": 52,
      "kind": "throw",
      "step": "survival",
      "dice": [
        2,
        1
      ],
      "target": "5+",
      "total": 3,
      "succeeded": false
    },
    {
      "seq": 53,
      "kind": "outcome",
      "because": 52,
      "description": "died in term 4, aged 34",
      "errata": [
        "E004"
      ]
    }
  ]
}
